{
  "$schema": "http://json-schema.org/draft-07/schema#",
  "$id": "https://github.com/microsoft/mcp-server-registry/schemas/manifest.schema.json",
  "title": "Hosted MCP Server Manifest",
  "description": "Schema for submitting an MCP server to the Azure Logic Apps hosted MCP server platform.",
  "type": "object",
  "required": ["id", "name", "description", "version", "publisher", "links", "source"],
  "additionalProperties": false,
  "properties": {
    "$schema": {
      "type": "string",
      "description": "Reference to this schema for editor validation."
    },
    "id": {
      "type": "string",
      "pattern": "^[a-z0-9][a-z0-9-]{1,62}[a-z0-9]$",
      "description": "Unique server identifier. Lowercase alphanumeric and hyphens only (3-64 chars). This becomes the folder name under servers/ and the image repository under mcp-servers/ in ACR.",
      "examples": ["mcp-sql", "mcp-playwright", "mcp-github"]
    },
    "name": {
      "type": "string",
      "maxLength": 64,
      "description": "Human-readable display name shown in the Azure portal.",
      "examples": ["SQL MCP Server", "Playwright MCP Server"]
    },
    "description": {
      "type": "string",
      "maxLength": 256,
      "description": "Short description shown in the server catalog.",
      "examples": ["Enable AI agents to safely interact with SQL databases using Model Context Protocol."]
    },
    "longDescription": {
      "type": "string",
      "maxLength": 2000,
      "description": "Detailed description shown on the server detail page. Supports Markdown."
    },
    "icon": {
      "type": "string",
      "pattern": "^[a-zA-Z0-9._-]+\\.(svg|png)$",
      "description": "Filename of a square icon committed alongside this manifest in the same servers/{id}/ folder (SVG or PNG, minimum 64x64). The pipeline validates and re-hosts it to our portal CDN; the resolved URL is written to the catalog _meta. External URLs are not accepted. If omitted, a default icon is shown.",
      "examples": ["icon.svg", "icon.png"]
    },
    "version": {
      "type": "string",
      "pattern": "^(0|[1-9]\\d*)\\.(0|[1-9]\\d*)\\.(0|[1-9]\\d*)$",
      "description": "Semantic version (major.minor.patch).",
      "examples": ["1.0.0", "2.1.3"]
    },
    "recalledVersions": {
      "type": "array",
      "description": "Versions of this server that have been recalled (e.g. a critical bug was found). Recalled versions are excluded from 'latest' and from new deployments; auto-update deployments on a recalled version are automatically rolled back to the newest good compatible version. Equivalent to a 'yank' in PyPI/crates. Reverting the PR (removing a version here) un-recalls it.",
      "items": {
        "type": "string",
        "pattern": "^(0|[1-9]\\d*)\\.(0|[1-9]\\d*)\\.(0|[1-9]\\d*)$"
      },
      "uniqueItems": true,
      "examples": [["1.0.3"], ["1.0.3", "1.1.0"]]
    },
    "publisher": {
      "type": "object",
      "required": ["name"],
      "additionalProperties": false,
      "description": "Information about the server author or organization.",
      "properties": {
        "name": {
          "type": "string",
          "maxLength": 128,
          "description": "Publisher display name.",
          "examples": ["Microsoft", "Contoso Inc."]
        },
        "url": {
          "type": "string",
          "format": "uri",
          "pattern": "^https://",
          "description": "Publisher website URL."
        }
      }
    },
    "links": {
      "type": "object",
      "additionalProperties": false,
      "required": ["documentation"],
      "description": "Useful links for users and reviewers.",
      "properties": {
        "documentation": {
          "type": "string",
          "format": "uri",
          "pattern": "^https://",
          "description": "URL to user-facing documentation."
        },
        "source": {
          "type": "string",
          "format": "uri",
          "pattern": "^https://",
          "description": "URL to the MCP server source code repository."
        },
        "support": {
          "type": "string",
          "format": "uri",
          "pattern": "^https://",
          "description": "URL for filing issues or getting support."
        },
        "license": {
          "type": "string",
          "format": "uri",
          "pattern": "^https://",
          "description": "URL to the license file."
        },
        "changelog": {
          "type": "string",
          "format": "uri",
          "pattern": "^https://",
          "description": "URL to the changelog."
        }
      }
    },
    "source": {
      "type": "object",
      "required": ["type"],
      "description": "How the MCP server is delivered. Discriminated by 'type'. The pipeline always produces an HTTP image for ADC; when transport is 'stdio', the pipeline wraps the server with the McpTransportGateway tool.",
      "properties": {
        "type": {
          "enum": ["container", "github", "local"],
          "description": "Delivery mechanism: 'container' for a pre-built, digest-pinned image, 'github' to build the image from an external repo at a pinned commit, or 'local' to build the image from a Dockerfile bundled in this manifest's directory in this registry repository."
        }
      },
      "allOf": [
        {
          "if": {
            "properties": { "type": { "const": "container" } },
            "required": ["type"]
          },
          "then": { "$ref": "#/definitions/containerSource" }
        },
        {
          "if": {
            "properties": { "type": { "const": "github" } },
            "required": ["type"]
          },
          "then": { "$ref": "#/definitions/githubSource" }
        },
        {
          "if": {
            "properties": { "type": { "const": "local" } },
            "required": ["type"]
          },
          "then": { "$ref": "#/definitions/localSource" }
        }
      ]
    },
    "authentication": {
      "type": "object",
      "additionalProperties": false,
      "description": "Declares how the server authenticates to its upstream data source. Rendered as a separate 'Authentication' section in the portal. If omitted, no auth section is shown (e.g., Playwright). Managed identity is provided by the Connector Namespace's UAMI, discovered via IMDS - no env var needed.",
      "required": ["methods"],
      "if": {
        "properties": { "methods": { "contains": { "const": "connection-string" } } }
      },
      "then": { "required": ["connectionStringVariable"] },
      "properties": {
        "methods": {
          "type": "array",
          "items": {
            "type": "string",
            "enum": ["managed-identity", "connection-string"]
          },
          "minItems": 1,
          "uniqueItems": true,
          "description": "Supported authentication methods. When both are listed, the portal renders a picker; when only one, it's shown directly.",
          "examples": [["managed-identity", "connection-string"], ["connection-string"]]
        },
        "default": {
          "type": "string",
          "enum": ["managed-identity", "connection-string"],
          "description": "Default auth method pre-selected in the portal picker. Only meaningful when methods has more than one entry."
        },
        "connectionStringVariable": {
          "type": "string",
          "pattern": "^[A-Z_][A-Z0-9_]*$",
          "description": "Environment variable name the connection string is injected as. Required when methods includes 'connection-string'.",
          "examples": ["CONNECTION_STRING", "COSMOSDB_CONNECTION_STRING"]
        }
      }
    },
    "configuration": {
      "type": "array",
      "description": "Configuration inputs the server accepts. Each input is collected from the user in the Azure portal and delivered to the container either as an environment variable or, for 'file' inputs, as a file mounted inside the container. Values are supplied at deployment time and are never stored in this manifest.",
      "items": {
        "type": "object",
        "required": ["name", "description"],
        "additionalProperties": false,
        "properties": {
          "name": {
            "type": "string",
            "description": "Input identifier. For every type except 'file' this is the environment variable name (UPPER_SNAKE_CASE) the value is injected as; for 'file' inputs it is a logical identifier used in the portal.",
            "examples": ["DATABASE_CONNECTION_STRING", "API_KEY", "configFile"]
          },
          "type": {
            "type": "string",
            "enum": ["string", "secret", "int", "bool", "enum", "file"],
            "default": "string",
            "description": "Input type, modelled on an HTML <input type>. It drives both the portal widget (text box, masked field, number, toggle, dropdown, or file upload) and how the value reaches the container: 'file' is written as a mounted file (see targetDirectory and fileName); every other type is injected as the environment variable named by 'name'."
          },
          "description": {
            "type": "string",
            "maxLength": 256,
            "description": "User-facing description shown in the portal."
          },
          "isRequired": {
            "type": "boolean",
            "default": false,
            "description": "Whether the server requires this input to start."
          },
          "default": {
            "type": "string",
            "description": "Default value applied when the user does not provide one. Not used for 'file' inputs."
          },
          "allowedValues": {
            "type": "array",
            "items": { "type": "string" },
            "minItems": 1,
            "uniqueItems": true,
            "description": "The permitted values, rendered as a dropdown in the portal. Required when type is 'enum'.",
            "examples": [["development", "production"]]
          },
          "targetDirectory": {
            "type": "string",
            "pattern": "^/",
            "description": "Absolute directory inside the container where the uploaded file is written. Required when type is 'file'.",
            "examples": ["/App", "/etc/mcp"]
          },
          "fileName": {
            "type": "string",
            "description": "Name the uploaded file is given inside targetDirectory. Required when type is 'file'.",
            "examples": ["dab-config.json", "config.yaml"]
          }
        },
        "allOf": [
          {
            "if": {
              "properties": { "type": { "const": "file" } },
              "required": ["type"]
            },
            "then": {
              "required": ["targetDirectory", "fileName"],
              "properties": { "name": { "pattern": "^[a-zA-Z][a-zA-Z0-9_-]*$" } }
            },
            "else": {
              "properties": { "name": { "pattern": "^[A-Z_][A-Z0-9_]*$" } }
            }
          },
          {
            "if": {
              "properties": { "type": { "const": "enum" } },
              "required": ["type"]
            },
            "then": { "required": ["allowedValues"] }
          }
        ]
      }
    },
    "capabilities": {
      "type": "array",
      "description": "MCP capabilities this server supports. Used for filtering in the catalog.",
      "items": {
        "type": "string",
        "enum": ["tools", "resources", "prompts", "sampling"]
      },
      "uniqueItems": true,
      "examples": [["tools", "resources"]]
    },
    "tags": {
      "type": "array",
      "description": "Searchable tags for catalog discovery.",
      "items": {
        "type": "string",
        "maxLength": 32,
        "pattern": "^[a-z0-9-]+$"
      },
      "maxItems": 10,
      "uniqueItems": true,
      "examples": [["database", "sql", "query"]]
    }
  },
  "definitions": {
    "containerSource": {
      "type": "object",
      "additionalProperties": false,
      "required": ["type", "image"],
      "properties": {
        "type": { "const": "container" },
        "image": {
          "type": "string",
          "pattern": "^[a-z0-9._/-]+@sha256:[a-f0-9]{64}$",
          "description": "Digest-pinned image reference from a public registry. Tags are not accepted - use the immutable sha256 digest.",
          "examples": [
            "ghcr.io/your-org/mcp-my-server@sha256:a1b2c3d4e5f6a1b2c3d4e5f6a1b2c3d4e5f6a1b2c3d4e5f6a1b2c3d4e5f6a1b2"
          ]
        },
        "transport": {
          "type": "string",
          "enum": ["http", "stdio"],
          "default": "http",
          "description": "MCP transport the image serves. When 'stdio', the pipeline wraps the image with McpTransportGateway to expose HTTP."
        },
        "command": {
          "type": "string",
          "description": "Command that starts the STDIO MCP server inside the image. Required when transport is 'stdio'.",
          "examples": ["my-mcp-server --some-flag", "node dist/index.js"]
        },
        "targetPort": {
          "type": "integer",
          "minimum": 1,
          "maximum": 65535,
          "description": "Port the MCP server listens on inside the container. Required for http; ignored for stdio (the gateway sets port 8080)."
        },
        "mcpServerRoute": {
          "type": "string",
          "pattern": "^/",
          "default": "/",
          "description": "HTTP path prefix where the MCP SSE/Streamable HTTP endpoint is served. Ignored for stdio (the gateway sets route /mcp)."
        }
      },
      "if": {
        "properties": { "transport": { "const": "stdio" } },
        "required": ["transport"]
      },
      "then": { "required": ["command"] },
      "else": { "required": ["targetPort"] }
    },
    "githubSource": {
      "type": "object",
      "additionalProperties": false,
      "required": ["type", "repo", "commit", "dockerfile"],
      "properties": {
        "type": { "const": "github" },
        "repo": {
          "type": "string",
          "format": "uri",
          "pattern": "^https://",
          "description": "GitHub repository URL containing the MCP server source and Dockerfile.",
          "examples": ["https://github.com/org/mcp-server"]
        },
        "commit": {
          "type": "string",
          "pattern": "^[a-f0-9]{40}$",
          "description": "Full 40-character commit SHA. Immutable - ensures we build exactly this version."
        },
        "dockerfile": {
          "type": "string",
          "description": "Path to the Dockerfile relative to the repo root.",
          "examples": ["./Dockerfile", "./docker/Dockerfile"]
        },
        "buildContext": {
          "type": "string",
          "description": "Path to the Docker build context relative to the repo root. Defaults to the repo root.",
          "examples": [".", "./src"]
        },
        "transport": {
          "type": "string",
          "enum": ["http", "stdio"],
          "default": "http",
          "description": "MCP transport the built image serves. When 'stdio', the pipeline wraps the built image with McpTransportGateway to expose HTTP."
        },
        "command": {
          "type": "string",
          "description": "Command that starts the STDIO MCP server inside the built image. Required when transport is 'stdio'.",
          "examples": ["my-mcp-server --some-flag", "node dist/index.js"]
        },
        "targetPort": {
          "type": "integer",
          "minimum": 1,
          "maximum": 65535,
          "description": "Port the MCP server listens on inside the built container. Required for http; ignored for stdio (the gateway sets port 8080)."
        },
        "mcpServerRoute": {
          "type": "string",
          "pattern": "^/",
          "default": "/",
          "description": "HTTP path prefix where the MCP SSE/Streamable HTTP endpoint is served. Ignored for stdio (the gateway sets route /mcp)."
        }
      },
      "if": {
        "properties": { "transport": { "const": "stdio" } },
        "required": ["transport"]
      },
      "then": { "required": ["command"] },
      "else": { "required": ["targetPort"] }
    },
    "localSource": {
      "type": "object",
      "additionalProperties": false,
      "required": ["type", "dockerfile"],
      "properties": {
        "type": { "const": "local" },
        "dockerfile": {
          "type": "string",
          "description": "Path to the Dockerfile, relative to this manifest's own directory (servers/{id}/), where it must be committed alongside this manifest. The image is built from the manifest's own commit - no external repository is cloned.",
          "examples": ["./Dockerfile", "./docker/Dockerfile"]
        },
        "buildContext": {
          "type": "string",
          "description": "Path to the Docker build context, relative to this manifest's own directory (servers/{id}/). Defaults to the manifest directory.",
          "examples": [".", "./build"]
        },
        "transport": {
          "type": "string",
          "enum": ["http", "stdio"],
          "default": "http",
          "description": "MCP transport the built image serves. When 'stdio', the pipeline wraps the built image with McpTransportGateway to expose HTTP."
        },
        "command": {
          "type": "string",
          "description": "Command that starts the STDIO MCP server inside the built image. Required when transport is 'stdio'.",
          "examples": ["my-mcp-server --some-flag", "node dist/index.js"]
        },
        "targetPort": {
          "type": "integer",
          "minimum": 1,
          "maximum": 65535,
          "description": "Port the MCP server listens on inside the built container. Required for http; ignored for stdio (the gateway sets port 8080)."
        },
        "mcpServerRoute": {
          "type": "string",
          "pattern": "^/",
          "default": "/",
          "description": "HTTP path prefix where the MCP SSE/Streamable HTTP endpoint is served. Ignored for stdio (the gateway sets route /mcp)."
        }
      },
      "if": {
        "properties": { "transport": { "const": "stdio" } },
        "required": ["transport"]
      },
      "then": { "required": ["command"] },
      "else": { "required": ["targetPort"] }
    }
  }
}
